{
  "schemaVersion": "1.0",
  "authorizationId": "EXAMPLE-DENIED",
  "profileId": "JAPAN_PUBLIC_CROSS_PLATFORM_MAINNET_V1",
  "releaseSubject": {
    "sourceCommit": null,
    "sourceTreeSha256": null,
    "androidArtifactSha256": null,
    "iosArtifactSha256": null,
    "backendImageDigest": null,
    "signerImageDigest": null,
    "configurationBundleSha256": null,
    "policyBundleSha256": null,
    "assetRegistrySha256": null,
    "sbomSha256": null,
    "releaseId": "2026-07-29.3-design-package",
    "environment": "DESIGN_ONLY"
  },
  "deploymentId": "EXAMPLE-NOT-DEPLOYED",
  "runtimeBundleId": "EXAMPLE-RUNTIME-STOPPED",
  "runtimeLeaseId": "EXAMPLE-NO-WRITE",
  "accountBindingId": "EXAMPLE-ACCOUNT-BINDING",
  "account": "0x0000000000000000000000000000000000000000",
  "executionCapsuleHash": "0x0000000000000000000000000000000000000000000000000000000000000000",
  "sourceStateHash": "0x0000000000000000000000000000000000000000000000000000000000000000",
  "quoteHash": null,
  "nonce": "EXAMPLE-DENIED-NONCE",
  "issuedAt": "2026-07-28T11:10:00Z",
  "expiresAt": "2026-07-28T11:10:30Z",
  "requiredCapabilities": [],
  "authorized": false,
  "userAuthorization": null,
  "deviceAuthorization": null,
  "policyAuthorization": null,
  "oneTimeUse": true,
  "quoteValidUntil": null
}
